Data_File,Component,Description,Fields,Update_Frequency
demo.csv,Dashboard,Main project portfolio data,Portfolio,Program,Project,BPM_ID,Project_Manager,G0,G5_Previous,G5_Current,Other_Detail,Status,Budget,Spent,BudgetStatus,FundingSource,RDCategory,Milestone_Phase,ROI_Percentage,Cost_Variance,Timeline_Variance,Resource_Allocation,Innovation_Score,Risk_Level,Market_Impact,Weekly
budget-statuses.csv,BudgetFinance,Budget status definitions and colors,Status,Description,Color,Priority,Monthly
rd-categories.csv,BudgetFinance,R&D category definitions and metadata,Category,Description,Type,Complexity,Average_Duration_Months,Monthly
status-colors.csv,BudgetFinance,Project status definitions and colors,Status,Color,Description,Priority_Level,Monthly
milestone-phases.csv,BudgetFinance,Project milestone phase definitions,Phase,Description,Duration_Months,Success_Rate,Cost_Multiplier,Monthly
time-periods.csv,AdvancedCharts,Time period definitions for charts,Period,Abbreviation,Full_Name,Quarter,Season,Quarterly
